{
  "id": "work-beth-harmon",
  "title": "The Queen's Gambit",
  "media_type": "television_series",
  "release_year": 2020,
  "country_or_region": [],
  "language": [
    "en"
  ],
  "source_ids": [
    "source-beth-harmon"
  ],
  "content_warnings": [
    "substance use",
    "bereavement",
    "addiction"
  ],
  "review_status": "draft"
}
