{
  "id": "work-carmen-berzatto",
  "title": "The Bear",
  "media_type": "television_series",
  "release_year": 2022,
  "country_or_region": [],
  "language": [
    "en"
  ],
  "source_ids": [
    "source-carmen-berzatto"
  ],
  "content_warnings": [
    "family conflict",
    "panic",
    "verbal aggression",
    "bereavement"
  ],
  "review_status": "draft"
}
