{
  "id": "work-adrian-monk",
  "title": "Monk",
  "media_type": "television_series",
  "release_year": 2002,
  "country_or_region": [],
  "language": [
    "en"
  ],
  "source_ids": [
    "source-adrian-monk"
  ],
  "content_warnings": [
    "bereavement",
    "anxiety",
    "crime-related violence"
  ],
  "review_status": "draft"
}
