{
  "content_warnings": [
    "child physical abuse by a parent",
    "parental rejection",
    "scenes of fire and burning"
  ],
  "country_or_region": [
    "US"
  ],
  "creator_names": [
    "Michael Dante DiMartino",
    "Bryan Konietzko"
  ],
  "id": "work-zuko",
  "language": [
    "en"
  ],
  "media_type": "animation",
  "release_year": 2005,
  "review_status": "draft",
  "source_ids": [
    "source-zuko"
  ],
  "title": "Avatar: The Last Airbender"
}