{
  "id": "work-sam-gardner",
  "title": "Atypical",
  "media_type": "television_series",
  "release_year": 2017,
  "country_or_region": [],
  "language": [
    "en"
  ],
  "source_ids": [
    "source-sam-gardner"
  ],
  "content_warnings": [
    "family conflict",
    "bullying",
    "relationship stress"
  ],
  "review_status": "draft"
}
