{
  "id": "work-aza-holmes",
  "title": "Turtles All the Way Down",
  "media_type": "book",
  "release_year": 2017,
  "country_or_region": [],
  "language": [
    "en"
  ],
  "source_ids": [
    "source-aza-holmes"
  ],
  "content_warnings": [
    "intrusive thoughts",
    "anxiety",
    "death"
  ],
  "review_status": "draft"
}
