{
  "id": "work-diane-nguyen",
  "title": "BoJack Horseman",
  "media_type": "animation",
  "release_year": 2014,
  "country_or_region": [],
  "language": [
    "en"
  ],
  "source_ids": [
    "source-diane-nguyen"
  ],
  "content_warnings": [
    "depression themes",
    "family abuse",
    "suicide themes"
  ],
  "review_status": "draft"
}
