{
  "id": "work-evelyn-wang",
  "title": "Everything Everywhere All at Once",
  "media_type": "film",
  "release_year": 2022,
  "country_or_region": [],
  "language": [
    "en"
  ],
  "source_ids": [
    "source-evelyn-wang"
  ],
  "content_warnings": [
    "violence",
    "existential distress",
    "family conflict"
  ],
  "review_status": "draft"
}
