{
  "id": "work-bojack-horseman",
  "title": "BoJack Horseman",
  "media_type": "animation",
  "release_year": 2014,
  "country_or_region": [],
  "language": [
    "en"
  ],
  "source_ids": [
    "source-bojack-horseman"
  ],
  "content_warnings": [
    "substance use",
    "suicide themes",
    "abuse"
  ],
  "review_status": "draft"
}
