{
  "id": "work-luz-noceda",
  "title": "The Owl House",
  "media_type": "animation",
  "release_year": 2020,
  "country_or_region": [],
  "language": [
    "en"
  ],
  "source_ids": [
    "source-luz-noceda"
  ],
  "content_warnings": [
    "bereavement themes",
    "family conflict",
    "peril"
  ],
  "review_status": "draft"
}
