{
  "id": "work-charlie-kelmeckis",
  "title": "The Perks of Being a Wallflower",
  "media_type": "film",
  "release_year": 2012,
  "country_or_region": [],
  "language": [
    "en"
  ],
  "source_ids": [
    "source-charlie-kelmeckis"
  ],
  "content_warnings": [
    "sexual abuse",
    "suicide",
    "trauma",
    "substance use"
  ],
  "review_status": "draft"
}
