{
  "id": "work-riley-andersen",
  "title": "Inside Out",
  "media_type": "animation",
  "release_year": 2015,
  "country_or_region": [],
  "language": [
    "en"
  ],
  "source_ids": [
    "source-riley-andersen"
  ],
  "content_warnings": [
    "family separation",
    "emotional distress"
  ],
  "review_status": "draft"
}
