{
  "id": "work-mirabel-madrigal",
  "title": "Encanto",
  "media_type": "animation",
  "release_year": 2021,
  "country_or_region": [],
  "language": [
    "en"
  ],
  "source_ids": [
    "source-mirabel-madrigal"
  ],
  "content_warnings": [
    "family conflict",
    "emotional neglect themes"
  ],
  "review_status": "draft"
}
