{
  "id": "work-steven-universe",
  "title": "Steven Universe Future",
  "media_type": "animation",
  "release_year": 2019,
  "country_or_region": [],
  "language": [
    "en"
  ],
  "source_ids": [
    "source-steven-universe"
  ],
  "content_warnings": [
    "trauma themes",
    "panic",
    "emotional distress"
  ],
  "review_status": "draft"
}
