{
  "id": "work-miles-morales",
  "title": "Spider-Man: Into the Spider-Verse",
  "media_type": "animation",
  "release_year": 2018,
  "country_or_region": [],
  "language": [
    "en"
  ],
  "source_ids": [
    "source-miles-morales"
  ],
  "content_warnings": [
    "family conflict",
    "peril",
    "bereavement"
  ],
  "review_status": "draft"
}
