{
  "id": "work-ellie-williams",
  "title": "The Last of Us",
  "media_type": "video_game",
  "release_year": 2013,
  "country_or_region": [],
  "language": [
    "en"
  ],
  "source_ids": [
    "source-ellie-williams"
  ],
  "content_warnings": [
    "graphic violence",
    "bereavement",
    "trauma"
  ],
  "review_status": "draft"
}
