{
  "id": "work-mei-lee",
  "title": "Turning Red",
  "media_type": "animation",
  "release_year": 2022,
  "country_or_region": [],
  "language": [
    "en"
  ],
  "source_ids": [
    "source-mei-lee"
  ],
  "content_warnings": [
    "family conflict",
    "puberty themes"
  ],
  "review_status": "draft"
}
