{
  "content_warnings": [
    "fantasy violence",
    "parental abandonment"
  ],
  "country_or_region": [
    "Japan"
  ],
  "id": "work-black-clover",
  "language": [
    "ja"
  ],
  "release_year": 2015,
  "review_status": "draft",
  "source_ids": [
    "source-black-clover"
  ],
  "title": "Black Clover",
  "media_type": "anime"
}