{
  "id": "work-rebecca-bunch",
  "title": "Crazy Ex-Girlfriend",
  "media_type": "television_series",
  "release_year": 2015,
  "country_or_region": [],
  "language": [
    "en"
  ],
  "source_ids": [
    "source-rebecca-bunch"
  ],
  "content_warnings": [
    "suicide themes",
    "self-harm themes",
    "relationship conflict"
  ],
  "review_status": "draft"
}
